{"graph":{"edges":[],"nodes":[{"id":"3b6c96c2111cb06b12d366c7d0d0e961b2a4546b0513e616e3555328f7f2efdd","properties":{"ipv4_addresses":[],"ipv6_addresses":[],"mac_address":"","mtu":65536,"name":"lo","status":"UP"},"type":"node_logical"}]},"profile_id":"invaros.tbom.profile.edge_network_topology","profile_name":"InvarOS Edge Network Topology TBoM Profile","profile_version":"3.0.0","subsystem_identity":{"host_fingerprint":"e3b0c44298fc1c149afbf4c8996fb92427ae41e4649b934ca495991b7852b855","observed_at_epoch":1000000000},"tbom_version":"3.0.0","topology_fingerprint":"10ddf7d97cf6d59722eae2a50131f097d5870890f56ec212a712c3caf7cc4659"}