{"graph":{"edges":[{"relation_type":"bridge_member","source":"c4cf35a5140febec99915083f5d770f20de8511c3292510f2bc0b9834e389da0","target":"024ae95b03c7d4377d465bcdd6a47f95525be725b29038a7fc47e394372f15d9"},{"relation_type":"bridge_member","source":"f34192f4bf11965d02b14f7e52874ed9543ec76aed5edc61e3b46016815fa981","target":"024ae95b03c7d4377d465bcdd6a47f95525be725b29038a7fc47e394372f15d9"}],"nodes":[{"id":"024ae95b03c7d4377d465bcdd6a47f95525be725b29038a7fc47e394372f15d9","properties":{"ipv4_addresses":[],"ipv6_addresses":[],"mac_address":"","mtu":1500,"name":"br0","status":"UP"},"type":"node_bridge"},{"id":"c4cf35a5140febec99915083f5d770f20de8511c3292510f2bc0b9834e389da0","properties":{"ipv4_addresses":[],"ipv6_addresses":[],"mac_address":"aa:bb:cc:dd:ee:ff","mtu":1500,"name":"eth0","status":"UP"},"type":"node_physical"},{"id":"f34192f4bf11965d02b14f7e52874ed9543ec76aed5edc61e3b46016815fa981","properties":{"ipv4_addresses":[],"ipv6_addresses":[],"mac_address":"11:22:33:44:55:66","mtu":1500,"name":"eth1","status":"UP"},"type":"node_physical"}]},"profile_id":"invaros.tbom.profile.edge_network_topology","profile_name":"InvarOS Edge Network Topology TBoM Profile","profile_version":"3.0.0","subsystem_identity":{"host_fingerprint":"b29b67288ce987de8e8a9e0f346348604d0d99820b66f2a7e408ce6a1c2efe99","observed_at_epoch":1000000000},"tbom_version":"3.0.0","topology_fingerprint":"bb5c6d027d6258d33b5f712b1eee6c7e01b14f77662fa722ea752ba75500e269"}