{"graph":{"edges":[{"relation_type":"vlan_parent","source":"f87d1f0452634533a9a92f40c3e5db2705f8930f7b4bb6aea0cdce3489b6a7b3","target":"c4cf35a5140febec99915083f5d770f20de8511c3292510f2bc0b9834e389da0"}],"nodes":[{"id":"c4cf35a5140febec99915083f5d770f20de8511c3292510f2bc0b9834e389da0","properties":{"ipv4_addresses":["192.168.1.1"],"ipv6_addresses":[],"mac_address":"aa:bb:cc:dd:ee:ff","mtu":1500,"name":"eth0","status":"UP"},"type":"node_physical"},{"id":"f87d1f0452634533a9a92f40c3e5db2705f8930f7b4bb6aea0cdce3489b6a7b3","properties":{"ipv4_addresses":[],"ipv6_addresses":[],"mac_address":"","mtu":1500,"name":"eth0.10","status":"UP","vlan_tag":10},"type":"node_vlan"}]},"profile_id":"invaros.tbom.profile.edge_network_topology","profile_name":"InvarOS Edge Network Topology TBoM Profile","profile_version":"3.0.0","subsystem_identity":{"host_fingerprint":"fce9c29310f50588f7f66b7d291beb16262eeea305187c7c005c103cd1140757","observed_at_epoch":1000000000},"tbom_version":"3.0.0","topology_fingerprint":"48b361fd2706e33d9d3eff0e55a825a2dc4241df6a619d0135a5cdf719ad8cf8"}